{
  "audited_completion_tokens": 483,
  "audited_model_request_count": 8,
  "audited_prompt_tokens": 12040,
  "capture_attempt_count": 5,
  "captured_branch_count": 4,
  "checks": {
    "all_frozen_inputs_match_hashes": true,
    "all_returned_artifacts_match_bytes_and_hashes": true,
    "freeze_schema_is_closed": true,
    "invalid_output_cost_undercount_detected": true,
    "invalid_user_output_preserved_without_retry": true,
    "model_task_and_gpu_boundaries_reported_open": true,
    "no_target_or_non_idempotent_side_effect_executed": true,
    "preflight_passed_all_checks": true,
    "reported_cost_matches_returned_result": true,
    "rerun_comparison_and_claim_gates_closed": true,
    "returned_result_matches_closed_run_shape": true,
    "six_freeze_tests_pass": true,
    "stopped_at_fifth_attempt_with_four_pre_action_captures": true,
    "validation_matches_closed_schema_fields": true,
    "worker_record_cost_recomputed": true
  },
  "comparison_protocol_authorized": false,
  "confirmatory_claim_authorized": false,
  "cost_accounting_complete": false,
  "duplicate_non_idempotent_execution_count": 0,
  "freeze_config_sha256": "70115462096acedc842a34a4fefde508f46c7d3c2f4f616992263ba8bd6b903a",
  "gpu_used": true,
  "model_loaded": true,
  "model_outputs_read": true,
  "next_gate": "stop_tau3_acquisition_line_and_report",
  "passed": true,
  "post_failure_captured_count": 0,
  "preflight_sha256": "6ab431d8df18a6692ce4b65c404215265b2326d10876d4390eee9adce4d2c0a1",
  "remote_project_revision": "8fd7c469ec70d8c406828903d83a0999470d2a5a",
  "reported_completion_tokens": 444,
  "reported_model_request_count": 7,
  "reported_prompt_tokens": 11366,
  "rerun_authorized": false,
  "result_sha256": "1ef8b60c89287b51e26ca13a05683656c7dae0ae929571eeb32914b46f735e7c",
  "run_kind": "proper_v2_3_tau3_acquisition_result_freeze",
  "schema_version": 1,
  "scientific_stage_passed": false,
  "stop_reason": "invalid_user_output",
  "target_state_change_execution_count": 0,
  "task_executed": true,
  "worker_stderr_sha256": "b037e9c5e4ed064eea57599b054aac5bfe39710a4b1ec92f777b728457642993"
}
